{
  "$schema": "http://json-schema.org/draft-07/schema#",
  "title": "fanin agent-mode output envelope",
  "description": "Stable agent-mode JSON envelope produced by `fanin --json`. All RTLScanner subcommands share the same top-level shape.",
  "type": "object",
  "required": [
    "tool",
    "version",
    "status",
    "command",
    "data",
    "diagnostics",
    "errors",
    "summary"
  ],
  "properties": {
    "tool": {
      "type": "string",
      "const": "fanin"
    },
    "version": {
      "type": "string"
    },
    "status": {
      "type": "string",
      "enum": [
        "ok",
        "error"
      ]
    },
    "command": {
      "type": "object",
      "description": "Echo of the parsed argparse Namespace minus output flags."
    },
    "data": {
      "oneOf": [
        {
          "type": "object",
          "required": [
            "mode",
            "scope",
            "signal",
            "start"
          ],
          "properties": {
            "mode": {
              "type": "string",
              "const": "fanin"
            },
            "scope": {
              "type": "string"
            },
            "signal": {
              "type": "string",
              "description": "Starting signal name."
            },
            "bit_select": {
              "type": "string",
              "description": "Present when the query used a bit-select (e.g. '[5]', '[7:4]'): the traversal follows only edges touching those bits and maps the range across each hop (bit-level dataflow)."
            },
            "start": {
              "type": "string",
              "description": "Elaborated hierarchical path of the starting signal."
            },
            "max_depth": {
              "type": "integer"
            },
            "nodes": {
              "type": "array",
              "items": {
                "type": "string"
              },
              "description": "Full graph; absent with --summary."
            },
            "edges": {
              "type": "array",
              "items": {
                "type": "object",
                "required": [
                  "source",
                  "target",
                  "kind",
                  "description"
                ],
                "properties": {
                  "source": {
                    "type": "string"
                  },
                  "target": {
                    "type": "string"
                  },
                  "kind": {
                    "type": "string"
                  },
                  "description": {
                    "type": "string"
                  },
                  "source_type": {
                    "type": "string"
                  },
                  "target_type": {
                    "type": "string"
                  },
                  "source_bits": {
                    "type": "string",
                    "description": "Bit sub-range of the source that this edge reads ('[5]' / '[7:4]'); absent when the whole signal is read. Bit-level dataflow (slang-netlist parity)."
                  },
                  "target_bits": {
                    "type": "string",
                    "description": "Bit sub-range of the target that this edge drives; absent when the whole signal is driven. With source_bits, answers 'dout[5] comes from a[2]'."
                  },
                  "segments": {
                    "type": "array",
                    "items": {
                      "type": "object",
                      "properties": {
                        "source_bits": {
                          "type": "string"
                        },
                        "target_bits": {
                          "type": "string"
                        }
                      },
                      "required": [
                        "source_bits",
                        "target_bits"
                      ]
                    },
                    "description": "Per-bit permutation map for a copy whose offset varies (a bit reversal 'rev[i]=din[7-i]', a swap 'o={a[3:0],a[7:4]}') — a list of {source_bits, target_bits} sub-copies, e.g. 'din[7] -> rev[0]'. Present only for such a permutation; single-offset and whole-signal edges omit it (source_bits/target_bits then carry the map)."
                  },
                  "file": {
                    "type": "string"
                  },
                  "line": {
                    "type": "integer"
                  },
                  "depth": {
                    "type": "integer"
                  },
                  "clocked": {
                    "type": "boolean",
                    "description": "Present and true when the edge is registered (its target is driven by an edge-triggered always_ff / latch / edge-sensitive always) — i.e. a flip-flop boundary; absent for combinational edges (continuous assign, always_comb, port connection)."
                  }
                },
                "additionalProperties": true
              },
              "description": "Full graph; absent with --summary."
            },
            "summary_only": {
              "type": "boolean",
              "description": "True when --summary was used: the full nodes/edges arrays are omitted in favor of counts."
            },
            "node_count": {
              "type": "integer",
              "description": "--summary only."
            },
            "edge_count": {
              "type": "integer",
              "description": "--summary only."
            },
            "edges_by_depth": {
              "type": "object",
              "additionalProperties": {
                "type": "integer"
              },
              "description": "--summary only: edge count per BFS depth."
            },
            "direct": {
              "type": "array",
              "items": {
                "type": "string"
              },
              "description": "--summary only: depth-1 neighbors (direct sources for fanin, direct sinks for fanout)."
            }
          }
        },
        {
          "type": "null"
        }
      ]
    },
    "diagnostics": {
      "type": "array",
      "items": {
        "type": "object",
        "required": [
          "severity",
          "file",
          "line",
          "col",
          "message"
        ],
        "properties": {
          "severity": {
            "type": "string",
            "enum": [
              "error",
              "warning",
              "note",
              "info"
            ]
          },
          "file": {
            "type": "string"
          },
          "line": {
            "type": "integer",
            "minimum": 0
          },
          "col": {
            "type": "integer",
            "minimum": 0
          },
          "message": {
            "type": "string"
          }
        },
        "additionalProperties": false
      }
    },
    "errors": {
      "type": "array",
      "items": {
        "type": "object",
        "required": [
          "code",
          "message"
        ],
        "properties": {
          "code": {
            "type": "string",
            "enum": [
              "INPUT_NOT_FOUND",
              "BAD_FILELIST",
              "COMPILE_FAILED",
              "SCOPE_NOT_FOUND",
              "SIGNAL_NOT_FOUND",
              "BAD_CONFIG",
              "NO_TOP",
              "INTERNAL_ERROR"
            ]
          },
          "message": {
            "type": "string"
          },
          "details": {
            "type": "object",
            "description": "Machine-readable recovery hints. For SCOPE_NOT_FOUND: valid_prefix, failing_component, close_matches, children. For SIGNAL_NOT_FOUND: close_matches, available."
          }
        },
        "additionalProperties": false
      }
    },
    "summary": {
      "oneOf": [
        {
          "type": "object",
          "required": [
            "mode",
            "results"
          ],
          "properties": {
            "mode": {
              "type": "string"
            },
            "results": {
              "type": "integer"
            },
            "nodes": {
              "type": "integer"
            },
            "edges": {
              "type": "integer"
            },
            "max_depth": {
              "type": "integer"
            },
            "truncated": {
              "type": "boolean",
              "description": "True when an emitted list was capped by --limit; the count fields still report the true totals."
            },
            "limit": {
              "type": "integer",
              "description": "Effective per-list item cap that was applied (0 means unlimited)."
            }
          }
        },
        {
          "type": "null"
        }
      ]
    }
  },
  "additionalProperties": false
}
