{
  "tool": "fanin",
  "version": "0.3.0",
  "status": "ok",
  "command": {
    "cmd": "fanin",
    "files": [],
    "dir": [
      "examples/trace"
    ],
    "filelist": [],
    "exclude": [],
    "single_unit": false,
    "signal": "q",
    "scope": "trace_top.u_dp.u_pipe",
    "depth": null,
    "comb": true,
    "summary": false,
    "unroll": null,
    "max_unroll": null
  },
  "data": {
    "mode": "fanin",
    "scope": "trace_top.u_dp.u_pipe",
    "signal": "q",
    "start": "trace_top.u_dp.u_pipe.q",
    "nodes": [
      "trace_top.u_dp.u_pipe.q",
      "trace_top.u_dp.u_pipe.d",
      "trace_top.u_dp.u_pipe.en",
      "trace_top.u_dp.u_pipe.rst_n",
      "trace_top.u_dp.mux_out",
      "trace_top.u_dp.en",
      "trace_top.u_dp.rst_n",
      "trace_top.u_dp.u_mux.y",
      "trace_top.enable",
      "trace_top.rst_n",
      "trace_top.u_dp.u_mux.a",
      "trace_top.u_dp.u_mux.b",
      "trace_top.u_dp.u_mux.sel",
      "trace_top.u_dp.data_a",
      "trace_top.u_dp.data_b",
      "trace_top.u_dp.sel",
      "trace_top.in_a",
      "trace_top.in_b",
      "trace_top.mode"
    ],
    "edges": [
      {
        "source": "trace_top.u_dp.u_pipe.d",
        "target": "trace_top.u_dp.u_pipe.q",
        "kind": "procedural",
        "description": "always_ff",
        "source_type": "logic[7:0]",
        "target_type": "logic[7:0]",
        "file": "examples/trace/trace_top.sv",
        "line": 14,
        "clocked": true,
        "depth": 1
      },
      {
        "source": "trace_top.u_dp.u_pipe.en",
        "target": "trace_top.u_dp.u_pipe.q",
        "kind": "procedural",
        "description": "always_ff",
        "source_type": "logic",
        "target_type": "logic[7:0]",
        "file": "examples/trace/trace_top.sv",
        "line": 14,
        "clocked": true,
        "depth": 1
      },
      {
        "source": "trace_top.u_dp.u_pipe.rst_n",
        "target": "trace_top.u_dp.u_pipe.q",
        "kind": "procedural",
        "description": "always_ff",
        "source_type": "logic",
        "target_type": "logic[7:0]",
        "file": "examples/trace/trace_top.sv",
        "line": 14,
        "clocked": true,
        "depth": 1
      },
      {
        "source": "trace_top.u_dp.mux_out",
        "target": "trace_top.u_dp.u_pipe.d",
        "kind": "port_connection",
        "description": "u_pipe.d input",
        "source_type": "logic[7:0]",
        "target_type": "logic[7:0]",
        "file": "examples/trace/trace_top.sv",
        "line": 37,
        "depth": 2
      },
      {
        "source": "trace_top.u_dp.en",
        "target": "trace_top.u_dp.u_pipe.en",
        "kind": "port_connection",
        "description": "u_pipe.en input",
        "source_type": "logic",
        "target_type": "logic",
        "file": "examples/trace/trace_top.sv",
        "line": 37,
        "depth": 2
      },
      {
        "source": "trace_top.u_dp.rst_n",
        "target": "trace_top.u_dp.u_pipe.rst_n",
        "kind": "port_connection",
        "description": "u_pipe.rst_n input",
        "source_type": "logic",
        "target_type": "logic",
        "file": "examples/trace/trace_top.sv",
        "line": 37,
        "depth": 2
      },
      {
        "source": "trace_top.u_dp.u_mux.y",
        "target": "trace_top.u_dp.mux_out",
        "kind": "port_connection",
        "description": "u_mux.y output",
        "source_type": "logic[7:0]",
        "target_type": "logic[7:0]",
        "file": "examples/trace/trace_top.sv",
        "line": 36,
        "depth": 3
      },
      {
        "source": "trace_top.enable",
        "target": "trace_top.u_dp.en",
        "kind": "port_connection",
        "description": "u_dp.en input",
        "source_type": "logic",
        "target_type": "logic",
        "file": "examples/trace/trace_top.sv",
        "line": 47,
        "depth": 3
      },
      {
        "source": "trace_top.rst_n",
        "target": "trace_top.u_dp.rst_n",
        "kind": "port_connection",
        "description": "u_dp.rst_n input",
        "source_type": "logic",
        "target_type": "logic",
        "file": "examples/trace/trace_top.sv",
        "line": 47,
        "depth": 3
      },
      {
        "source": "trace_top.u_dp.u_mux.a",
        "target": "trace_top.u_dp.u_mux.y",
        "kind": "continuous_assign",
        "description": "assign",
        "source_type": "logic[7:0]",
        "target_type": "logic[7:0]",
        "file": "examples/trace/trace_top.sv",
        "line": 6,
        "depth": 4
      },
      {
        "source": "trace_top.u_dp.u_mux.b",
        "target": "trace_top.u_dp.u_mux.y",
        "kind": "continuous_assign",
        "description": "assign",
        "source_type": "logic[7:0]",
        "target_type": "logic[7:0]",
        "file": "examples/trace/trace_top.sv",
        "line": 6,
        "depth": 4
      },
      {
        "source": "trace_top.u_dp.u_mux.sel",
        "target": "trace_top.u_dp.u_mux.y",
        "kind": "continuous_assign",
        "description": "assign",
        "source_type": "logic",
        "target_type": "logic[7:0]",
        "file": "examples/trace/trace_top.sv",
        "line": 6,
        "depth": 4
      },
      {
        "source": "trace_top.u_dp.data_a",
        "target": "trace_top.u_dp.u_mux.a",
        "kind": "port_connection",
        "description": "u_mux.a input",
        "source_type": "logic[7:0]",
        "target_type": "logic[7:0]",
        "file": "examples/trace/trace_top.sv",
        "line": 36,
        "depth": 5
      },
      {
        "source": "trace_top.u_dp.data_b",
        "target": "trace_top.u_dp.u_mux.b",
        "kind": "port_connection",
        "description": "u_mux.b input",
        "source_type": "logic[7:0]",
        "target_type": "logic[7:0]",
        "file": "examples/trace/trace_top.sv",
        "line": 36,
        "depth": 5
      },
      {
        "source": "trace_top.u_dp.sel",
        "target": "trace_top.u_dp.u_mux.sel",
        "kind": "port_connection",
        "description": "u_mux.sel input",
        "source_type": "logic",
        "target_type": "logic",
        "file": "examples/trace/trace_top.sv",
        "line": 36,
        "depth": 5
      },
      {
        "source": "trace_top.in_a",
        "target": "trace_top.u_dp.data_a",
        "kind": "port_connection",
        "description": "u_dp.data_a input",
        "source_type": "logic[7:0]",
        "target_type": "logic[7:0]",
        "file": "examples/trace/trace_top.sv",
        "line": 47,
        "depth": 6
      },
      {
        "source": "trace_top.in_b",
        "target": "trace_top.u_dp.data_b",
        "kind": "port_connection",
        "description": "u_dp.data_b input",
        "source_type": "logic[7:0]",
        "target_type": "logic[7:0]",
        "file": "examples/trace/trace_top.sv",
        "line": 47,
        "depth": 6
      },
      {
        "source": "trace_top.mode",
        "target": "trace_top.u_dp.sel",
        "kind": "port_connection",
        "description": "u_dp.sel input",
        "source_type": "logic",
        "target_type": "logic",
        "file": "examples/trace/trace_top.sv",
        "line": 47,
        "depth": 6
      }
    ],
    "max_depth": 6,
    "comb": true
  },
  "diagnostics": [],
  "errors": [],
  "summary": {
    "mode": "fanin",
    "results": 1,
    "nodes": 19,
    "edges": 18,
    "max_depth": 6,
    "truncated": false,
    "limit": 200
  }
}
